{
  "basis": {
    "atom_to_shell_count": [
      1,
      1,
      1
    ],
    "n_atoms": 3,
    "n_shells": 3,
    "nao": 3
  },
  "format": "xtbloom-scc-trace-v1",
  "input": {
    "atomic_numbers": [
      1,
      1,
      1
    ],
    "molecular_charge": 1.0,
    "positions": [
      -0.47073898552969001,
      0.81534384004086002,
      0.0,
      -0.47073898552969001,
      -0.81534384004086002,
      0.0,
      0.94147797105939002,
      0.0,
      0.0
    ],
    "spin_channels": 1,
    "temperature": 300.0,
    "unpaired_electrons": 0
  },
  "iterations": [
    {
      "convergence": {
        "energy": false,
        "overall": false,
        "population": false,
        "temperature": true
      },
      "density": [
        [
          [
            0.30724526437672434,
            0.30724526437672439,
            0.30724526437672411
          ],
          [
            0.30724526437672439,
            0.3072452643767245,
            0.30724526437672417
          ],
          [
            0.30724526437672411,
            0.30724526437672417,
            0.30724526437672389
          ]
        ]
      ],
      "eigenvalues": [
        [
          -0.56296284888402282,
          0.054677720889602682,
          0.054677720889603473
        ]
      ],
      "energy": -0.95976130926610503,
      "energy_delta": -0.95976130926610503,
      "hamiltonian": [
        [
          [
            -0.39204506335581341,
            -0.41474126102697106,
            -0.41474126102697123
          ],
          [
            -0.41474126102697106,
            -0.39204506335581341,
            -0.41474126102697123
          ],
          [
            -0.41474126102697123,
            -0.41474126102697123,
            -0.39204506335581341
          ]
        ]
      ],
      "index": 1,
      "mixed_dipoles": [
        [
          [
            0.0,
            0.0,
            0.0
          ],
          [
            0.0,
            0.0,
            0.0
          ],
          [
            0.0,
            0.0,
            0.0
          ]
        ]
      ],
      "mixed_qat": [
        [
          0.0,
          0.0,
          0.0
        ]
      ],
      "mixed_qsh": [
        [
          0.0,
          0.0,
          0.0
        ]
      ],
      "mixed_quadrupoles": [
        [
          [
            0.0,
            0.0,
            0.0,
            0.0,
            0.0,
            0.0
          ],
          [
            0.0,
            0.0,
            0.0,
            0.0,
            0.0,
            0.0
          ],
          [
            0.0,
            0.0,
            0.0,
            0.0,
            0.0,
            0.0
          ]
        ]
      ],
      "occupations": [
        [
          1.0,
          0.0,
          0.0
        ],
        [
          1.0,
          0.0,
          0.0
        ]
      ],
      "raw_dipoles": [
        [
          [
            -0.12689524971158322,
            0.2197890197396023,
            -0.0
          ],
          [
            -0.12689524971158325,
            -0.21978901973960233,
            -0.0
          ],
          [
            0.25379049942316645,
            1.3877787807814457e-17,
            -0.0
          ]
        ]
      ],
      "raw_qat": [
        [
          0.33333333333333282,
          0.33333333333333259,
          0.33333333333333326
        ]
      ],
      "raw_qsh": [
        [
          0.33333333333333282,
          0.33333333333333259,
          0.33333333333333326
        ]
      ],
      "raw_quadrupoles": [
        [
          [
            -0.017860710562258825,
            0.09280697445934441,
            -0.12502497393581374,
            -0.0,
            -0.0,
            0.14288568449807257
          ],
          [
            -0.017860710562258839,
            -0.092806974459344424,
            -0.12502497393581374,
            -0.0,
            -0.0,
            0.1428856844980726
          ],
          [
            -0.17860710562259063,
            -1.3877787807814457e-17,
            0.035721421124517927,
            -0.0,
            -0.0,
            0.14288568449807243
          ]
        ]
      ],
      "residual": [
        0.33333333333333282,
        0.33333333333333259,
        0.33333333333333326,
        -0.12689524971158322,
        0.2197890197396023,
        -0.0,
        -0.12689524971158325,
        -0.21978901973960233,
        -0.0,
        0.25379049942316645,
        1.3877787807814457e-17,
        -0.0,
        -0.017860710562258825,
        0.09280697445934441,
        -0.12502497393581374,
        -0.0,
        -0.0,
        0.14288568449807257,
        -0.017860710562258839,
        -0.092806974459344424,
        -0.12502497393581374,
        -0.0,
        -0.0,
        0.1428856844980726,
        -0.17860710562259063,
        -1.3877787807814457e-17,
        0.035721421124517927,
        -0.0,
        -0.0,
        0.14288568449807243
      ],
      "residual_rms": 0.14945617283233573
    },
    {
      "convergence": {
        "energy": true,
        "overall": false,
        "population": false,
        "temperature": true
      },
      "density": [
        [
          [
            0.30724526437672439,
            0.30724526437672428,
            0.30724526437672411
          ],
          [
            0.30724526437672428,
            0.30724526437672417,
            0.30724526437672395
          ],
          [
            0.30724526437672411,
            0.30724526437672395,
            0.30724526437672378
          ]
        ]
      ],
      "eigenvalues": [
        [
          -0.6880895933912583,
          -0.077960397661439487,
          -0.077960397661438793
        ]
      ],
      "energy": -0.95976130926610448,
      "energy_delta": 5.5511151231257827e-16,
      "hamiltonian": [
        [
          [
            -0.51925040743379169,
            -0.48688979387752057,
            -0.48688979387752079
          ],
          [
            -0.48688979387752057,
            -0.51925040743379169,
            -0.48688979387752079
          ],
          [
            -0.48688979387752079,
            -0.48688979387752079,
            -0.51925040743379169
          ]
        ]
      ],
      "index": 2,
      "mixed_dipoles": [
        [
          [
            -0.050758099884633291,
            0.087915607895840922,
            0.0
          ],
          [
            -0.050758099884633305,
            -0.087915607895840936,
            0.0
          ],
          [
            0.10151619976926658,
            5.551115123125783e-18,
            0.0
          ]
        ]
      ],
      "mixed_qat": [
        [
          0.13333333333333314,
          0.13333333333333305,
          0.1333333333333333
        ]
      ],
      "mixed_qsh": [
        [
          0.13333333333333314,
          0.13333333333333305,
          0.1333333333333333
        ]
      ],
      "mixed_quadrupoles": [
        [
          [
            -0.0071442842249035306,
            0.037122789783737765,
            -0.050009989574325502,
            0.0,
            0.0,
            0.057154273799229029
          ],
          [
            -0.0071442842249035358,
            -0.037122789783737772,
            -0.050009989574325502,
            0.0,
            0.0,
            0.057154273799229043
          ],
          [
            -0.071442842249036256,
            -5.551115123125783e-18,
            0.014288568449807172,
            0.0,
            0.0,
            0.057154273799228973
          ]
        ]
      ],
      "occupations": [
        [
          1.0,
          0.0,
          0.0
        ],
        [
          1.0,
          0.0,
          0.0
        ]
      ],
      "raw_dipoles": [
        [
          [
            -0.12689524971158322,
            0.21978901973960224,
            -0.0
          ],
          [
            -0.12689524971158317,
            -0.21978901973960221,
            -0.0
          ],
          [
            0.25379049942316639,
            -4.163336342344337e-17,
            -0.0
          ]
        ]
      ],
      "raw_qat": [
        [
          0.33333333333333282,
          0.33333333333333315,
          0.33333333333333348
        ]
      ],
      "raw_qsh": [
        [
          0.33333333333333282,
          0.33333333333333315,
          0.33333333333333348
        ]
      ],
      "raw_quadrupoles": [
        [
          [
            -0.017860710562258852,
            0.09280697445934441,
            -0.12502497393581369,
            -0.0,
            -0.0,
            0.14288568449807254
          ],
          [
            -0.017860710562258811,
            -0.092806974459344355,
            -0.12502497393581369,
            -0.0,
            -0.0,
            0.14288568449807248
          ],
          [
            -0.17860710562259058,
            5.5511151231257827e-17,
            0.03572142112451792,
            -0.0,
            -0.0,
            0.14288568449807237
          ]
        ]
      ],
      "residual": [
        0.19999999999999968,
        0.20000000000000009,
        0.20000000000000018,
        -0.07613714982694994,
        0.13187341184376133,
        -0.0,
        -0.076137149826949857,
        -0.13187341184376128,
        -0.0,
        0.15227429965389983,
        -4.7184478546569152e-17,
        -0.0,
        -0.010716426337355322,
        0.055684184675606645,
        -0.075014984361488179,
        -0.0,
        -0.0,
        0.085731410698843519,
        -0.010716426337355275,
        -0.055684184675606582,
        -0.075014984361488179,
        -0.0,
        -0.0,
        0.085731410698843435,
        -0.10716426337355432,
        6.1062266354383615e-17,
        0.021432852674710748,
        -0.0,
        -0.0,
        0.085731410698843408
      ],
      "residual_rms": 0.089673703699401461
    },
    {
      "convergence": {
        "energy": true,
        "overall": true,
        "population": true,